{
  "$schema": "https://json-schema.org/draft/2020-12/schema",
  "$id": "https://0xfanbase.github.io/Bitcoin-Engine-Room/schemas/health.schema.json",
  "title": "health.json",
  "type": "object",
  "required": ["schema_version", "generated_at", "metrics"],
  "additionalProperties": false,
  "properties": {
    "schema_version": {"type": "integer", "const": 1},
    "generated_at": {"type": "string", "format": "date-time"},
    "tip_height": {
      "type": "object",
      "description": "Chain tip height, fetched once daily as an input to the supply subsidy-schedule fallback/sanity check, persisted here so the frontend masthead odometer/halving stats can paint a committed value on boot instead of blank dashes. Optional: absent only if never successfully fetched (e.g. a fresh repo before the first successful pipeline run).",
      "required": ["height", "date"],
      "additionalProperties": false,
      "properties": {
        "height": {"type": "integer", "minimum": 0},
        "date": {"type": "string", "pattern": "^[0-9]{4}-[0-9]{2}-[0-9]{2}$"}
      }
    },
    "metrics": {
      "type": "object",
      "propertyNames": {
        "enum": ["price_daily", "hashrate_daily", "difficulty_daily", "supply_daily", "fng_daily"]
      },
      "additionalProperties": {
        "type": "object",
        "required": ["source", "status", "latency_ms", "consecutive_failures", "last_success_date", "stale_since"],
        "additionalProperties": false,
        "properties": {
          "source": {"type": ["string", "null"]},
          "status": {"type": "string", "enum": ["OK", "STALE"]},
          "latency_ms": {"type": ["number", "null"], "minimum": 0},
          "consecutive_failures": {"type": "integer", "minimum": 0},
          "last_success_date": {"type": ["string", "null"], "pattern": "^[0-9]{4}-[0-9]{2}-[0-9]{2}$"},
          "stale_since": {"type": ["string", "null"], "pattern": "^[0-9]{4}-[0-9]{2}-[0-9]{2}$"},
          "cross_source_variance_warn": {
            "type": "boolean",
            "description": "price_daily only, per spec Section 6: mempool.space vs CoinGecko price disagreement beyond threshold. Primary value is still recorded either way."
          },
          "last_date": {
            "type": "string",
            "pattern": "^[0-9]{4}-[0-9]{2}-[0-9]{2}$",
            "description": "Date of this metric's last known row (fresh or carried-forward) -- lets the frontend paint its gauge straight from health.json instead of fetching the full history file. Same mechanics as top-level tip_height, extended to these five metrics. Absent only if a metric has never successfully recorded a row (e.g. a fresh repo before the first backfill)."
          },
          "last_value": {
            "type": "number",
            "description": "This metric's last known value (fresh or carried-forward), mirroring last_date."
          },
          "last_classification": {
            "type": "string",
            "enum": ["Extreme Fear", "Fear", "Neutral", "Greed", "Extreme Greed"],
            "description": "fng_daily only -- mirrors the classification field carried alongside its value in fng_daily.json's own series rows."
          }
        }
      }
    }
  }
}
