{
  "schema_version": 1,
  "generated_at": "2026-10-15T11:57:19Z",
  "metrics": {
    "price_daily": {
      "source": "mempool_space",
      "status": "OK",
      "latency_ms": 544.0,
      "consecutive_failures": 0,
      "last_success_date": "2026-10-15",
      "stale_since": null,
      "cross_source_variance_warn": false,
      "last_date": "2026-10-15",
      "last_value": 80977.0
    },
    "hashrate_daily": {
      "source": "mempool_space",
      "status": "OK",
      "latency_ms": 304.5,
      "consecutive_failures": 0,
      "last_success_date": "2026-10-15",
      "stale_since": null,
      "last_date": "2026-10-15",
      "last_value": 1030.447782219908
    },
    "difficulty_daily": {
      "source": "mempool_space",
      "status": "OK",
      "latency_ms": 299.2,
      "consecutive_failures": 0,
      "last_success_date": "2026-10-15",
      "stale_since": null,
      "last_date": "2026-10-15",
      "last_value": 132716002350731.3
    },
    "supply_daily": {
      "source": "blockchain_info",
      "status": "OK",
      "latency_ms": 384.7,
      "consecutive_failures": 0,
      "last_success_date": "2026-10-15",
      "stale_since": null,
      "last_date": "2026-10-15",
      "last_value": 20098593.0
    },
    "fng_daily": {
      "source": "alternative_me",
      "status": "OK",
      "latency_ms": 125.9,
      "consecutive_failures": 0,
      "last_success_date": "2026-10-15",
      "stale_since": null,
      "last_date": "2026-10-15",
      "last_value": 53,
      "last_classification": "Neutral"
    }
  },
  "tip_height": {
    "height": 971567,
    "date": "2026-10-15"
  }
}
